number,value,datetime_start,datetime_complete,duration,params_entanglement,params_feature_map_type,params_paulis,params_reps,user_attrs_macro_f1,state,trial_number,feature_map_type,reps,entanglement,paulis,status,error_message,accuracy,macro_precision,macro_recall,macro_f1,weighted_f1,fit_time_seconds,inference_time_seconds,peak_cpu_percent,peak_ram_mb,peak_gpu_memory_mb
0,0.7201079622132254,2026-06-17 17:26:46.797661,2026-06-17 17:28:02.403468,0 days 00:01:15.605807,linear,ZZFeatureMap,,2,0.7201079622132254,COMPLETE,0,ZZFeatureMap,2,linear,,completed,,0.7213114754098361,0.7198275862068966,0.7207792207792207,0.7201079622132254,0.7216123537089888,44.95733949999703,30.641582099997322,110.8,323.16015625,3438.9453125
1,0.0,2026-06-17 17:28:02.403468,2026-06-17 17:28:02.404470,0 days 00:00:00.001002,linear,ZFeatureMap,,1,,COMPLETE,1,ZFeatureMap,1,linear,,failed,'NoneType' object has no attribute 'items',,,,,,,,,,
2,0.7201079622132254,2026-06-17 17:28:02.404470,2026-06-17 17:29:22.567148,0 days 00:01:20.162678,full,PauliFeatureMap,"[""Y"", ""Z""]",2,0.7201079622132254,COMPLETE,2,PauliFeatureMap,2,full,"[""Y"", ""Z""]",completed,,0.7213114754098361,0.7198275862068966,0.7207792207792207,0.7201079622132254,0.7216123537089888,47.93995369999902,32.21589369999856,208.3,323.54296875,3403.4453125
3,0.5255555555555556,2026-06-17 17:29:22.567148,2026-06-17 17:31:04.611360,0 days 00:01:42.044212,full,ZZFeatureMap,,2,0.5255555555555556,COMPLETE,3,ZZFeatureMap,2,full,,completed,,0.5409836065573771,0.532051282051282,0.5297619047619048,0.5255555555555556,0.532568306010929,60.84466059999977,41.19234400000278,103.9,326.08203125,3425.0078125
4,0.0,2026-06-17 17:31:04.611360,2026-06-17 17:31:04.611360,0 days 00:00:00,linear,ZFeatureMap,,1,,COMPLETE,4,ZFeatureMap,1,linear,,failed,'NoneType' object has no attribute 'items',,,,,,,,,,
5,0.6523744911804613,2026-06-17 17:31:04.611360,2026-06-17 17:31:54.497139,0 days 00:00:49.885779,linear,PauliFeatureMap,"[""Z"", ""ZZ""]",1,0.6523744911804613,COMPLETE,5,PauliFeatureMap,1,linear,"[""Z"", ""ZZ""]",completed,,0.6557377049180327,0.6530501089324618,0.652056277056277,0.6523744911804613,0.6551771692951042,29.790791200000967,20.08932040000218,108.0,325.703125,3408.7578125
6,0.6950000000000001,2026-06-17 17:31:54.497139,2026-06-17 17:32:57.280742,0 days 00:01:02.783603,full,ZZFeatureMap,,1,0.6950000000000001,COMPLETE,6,ZZFeatureMap,1,full,,completed,,0.7049180327868853,0.7097902097902098,0.6948051948051948,0.6950000000000001,0.6995081967213115,37.402825099998154,25.37552280000091,106.2,325.3359375,3408.4453125
7,0.6950000000000001,2026-06-17 17:32:57.281246,2026-06-17 17:34:00.297622,0 days 00:01:03.016376,full,ZZFeatureMap,,1,0.6950000000000001,COMPLETE,7,ZZFeatureMap,1,full,,completed,,0.7049180327868853,0.7097902097902098,0.6948051948051948,0.6950000000000001,0.6995081967213115,37.52207089999865,25.489801200004877,108.0,325.57421875,3407.1953125
8,0.7136150234741784,2026-06-17 17:34:00.298127,2026-06-17 17:34:54.501077,0 days 00:00:54.202950,circular,ZZFeatureMap,,1,0.7136150234741784,COMPLETE,8,ZZFeatureMap,1,circular,,completed,,0.7213114754098361,0.7248283752860412,0.7126623376623377,0.7136150234741784,0.7174632494420072,32.31975330000569,21.878541700003552,109.0,325.63671875,3382.0703125
9,0.7201079622132254,2026-06-17 17:34:54.501077,2026-06-17 17:36:17.531328,0 days 00:01:23.030251,circular,ZZFeatureMap,,2,0.7201079622132254,COMPLETE,9,ZZFeatureMap,2,circular,,completed,,0.7213114754098361,0.7198275862068966,0.7207792207792207,0.7201079622132254,0.7216123537089888,49.51391319999675,33.51009989999875,107.9,327.01171875,3382.0703125
10,0.0,2026-06-17 17:36:17.531328,2026-06-17 17:36:17.532329,0 days 00:00:00.001001,linear,ZFeatureMap,,3,,COMPLETE,10,ZFeatureMap,3,linear,,failed,'NoneType' object has no attribute 'items',,,,,,,,,,
11,0.7201079622132254,2026-06-17 17:36:17.532329,2026-06-17 17:37:36.578473,0 days 00:01:19.046144,full,PauliFeatureMap,"[""Y"", ""Z""]",2,0.7201079622132254,COMPLETE,11,PauliFeatureMap,2,full,"[""Y"", ""Z""]",completed,,0.7213114754098361,0.7198275862068966,0.7207792207792207,0.7201079622132254,0.7216123537089888,47.14412430000084,31.894372199996724,102.9,327.43359375,3381.6328125
12,0.751696065128901,2026-06-17 17:37:36.578473,2026-06-17 17:39:22.360850,0 days 00:01:45.782377,linear,PauliFeatureMap,"[""Y"", ""Z""]",3,0.751696065128901,COMPLETE,12,PauliFeatureMap,3,linear,"[""Y"", ""Z""]",completed,,0.7540983606557377,0.7527233115468409,0.751082251082251,0.751696065128901,0.7536979780679315,63.061781299998984,42.709631400000944,208.3,327.9453125,3381.9453125
13,0.702922077922078,2026-06-17 17:39:22.360850,2026-06-17 17:41:08.044953,0 days 00:01:45.684103,linear,PauliFeatureMap,"[""X"", ""Z""]",3,0.702922077922078,COMPLETE,13,PauliFeatureMap,3,linear,"[""X"", ""Z""]",completed,,0.7049180327868853,0.702922077922078,0.702922077922078,0.702922077922078,0.7049180327868853,63.026745199997094,42.645645999997214,208.3,327.7578125,3381.6328125
14,0.6885245901639344,2026-06-17 17:41:08.044953,2026-06-17 17:42:07.369120,0 days 00:00:59.324167,linear,PauliFeatureMap,"[""Z""]",3,0.6885245901639344,COMPLETE,14,PauliFeatureMap,3,linear,"[""Z""]",completed,,0.6885245901639344,0.6931818181818181,0.6931818181818181,0.6885245901639344,0.6885245901639344,35.27374599999894,24.042743600002723,126.0,328.6640625,3381.6328125
15,0.6013071895424837,2026-06-17 17:42:07.369120,2026-06-17 17:43:46.028912,0 days 00:01:38.659792,linear,ZZFeatureMap,,3,0.6013071895424837,COMPLETE,15,ZZFeatureMap,3,linear,,completed,,0.6065573770491803,0.6027472527472527,0.6011904761904762,0.6013071895424837,0.6050573234758385,58.7144785000055,39.935757800005376,104.8,328.796875,3381.6328125
16,0.6142728093947606,2026-06-17 17:43:46.028912,2026-06-17 17:45:36.323816,0 days 00:01:50.294904,linear,PauliFeatureMap,"[""X"", ""Y"", ""Z""]",2,0.6142728093947606,COMPLETE,16,PauliFeatureMap,2,linear,"[""X"", ""Y"", ""Z""]",completed,,0.6557377049180327,0.6971153846153846,0.6331168831168831,0.6142728093947606,0.6246390332755786,65.80986829999893,44.47635569999693,110.2,329.1015625,3381.6328125
17,0.4877260981912145,2026-06-17 17:45:36.323816,2026-06-17 17:46:58.567220,0 days 00:01:22.243404,circular,PauliFeatureMap,"[""ZZ""]",3,0.4877260981912145,COMPLETE,17,PauliFeatureMap,3,circular,"[""ZZ""]",completed,,0.5737704918032787,0.5955188679245282,0.5438311688311688,0.4877260981912145,0.5049349769136273,49.17513540000073,33.06006229999912,102.2,329.32421875,3381.6328125
18,0.7201079622132254,2026-06-17 17:46:58.567722,2026-06-17 17:48:12.780374,0 days 00:01:14.212652,linear,ZZFeatureMap,,2,0.7201079622132254,COMPLETE,18,ZZFeatureMap,2,linear,,completed,,0.7213114754098361,0.7198275862068966,0.7207792207792207,0.7201079622132254,0.7216123537089888,44.22139669999888,29.98443899999984,135.9,328.48828125,3381.4375
19,0.0,2026-06-17 17:48:12.780374,2026-06-17 17:48:12.781877,0 days 00:00:00.001503,linear,ZFeatureMap,,3,,COMPLETE,19,ZFeatureMap,3,linear,,failed,'NoneType' object has no attribute 'items',,,,,,,,,,
20,0.7201079622132254,2026-06-17 17:48:12.781877,2026-06-17 17:49:31.894835,0 days 00:01:19.112958,circular,PauliFeatureMap,"[""Y"", ""Z""]",2,0.7201079622132254,COMPLETE,20,PauliFeatureMap,2,circular,"[""Y"", ""Z""]",completed,,0.7213114754098361,0.7198275862068966,0.7207792207792207,0.7201079622132254,0.7216123537089888,47.06522340000083,32.04083130000072,104.6,329.33203125,3400.3671875
21,0.7201079622132254,2026-06-17 17:49:31.894835,2026-06-17 17:50:50.826380,0 days 00:01:18.931545,full,PauliFeatureMap,"[""Y"", ""Z""]",2,0.7201079622132254,COMPLETE,21,PauliFeatureMap,2,full,"[""Y"", ""Z""]",completed,,0.7213114754098361,0.7198275862068966,0.7207792207792207,0.7201079622132254,0.7216123537089888,47.13676430000487,31.787705700000515,195.3,329.3125,3342.8671875
22,0.7201079622132254,2026-06-17 17:50:50.826380,2026-06-17 17:52:09.952686,0 days 00:01:19.126306,full,PauliFeatureMap,"[""Y"", ""Z""]",2,0.7201079622132254,COMPLETE,22,PauliFeatureMap,2,full,"[""Y"", ""Z""]",completed,,0.7213114754098361,0.7198275862068966,0.7207792207792207,0.7201079622132254,0.7216123537089888,47.199649100002716,31.919222399999853,151.2,329.03125,3341.7421875
23,0.7201079622132254,2026-06-17 17:52:09.953190,2026-06-17 17:53:28.751239,0 days 00:01:18.798049,full,PauliFeatureMap,"[""Y"", ""Z""]",2,0.7201079622132254,COMPLETE,23,PauliFeatureMap,2,full,"[""Y"", ""Z""]",completed,,0.7213114754098361,0.7198275862068966,0.7207792207792207,0.7201079622132254,0.7216123537089888,46.92155869999988,31.869574700001976,107.5,328.4609375,3341.6796875
24,0.6013071895424837,2026-06-17 17:53:28.751239,2026-06-17 17:55:07.408860,0 days 00:01:38.657621,linear,PauliFeatureMap,"[""Z"", ""ZZ""]",3,0.6013071895424837,COMPLETE,24,PauliFeatureMap,3,linear,"[""Z"", ""ZZ""]",completed,,0.6065573770491803,0.6027472527472527,0.6011904761904762,0.6013071895424837,0.6050573234758385,58.78738280000107,39.86285659999703,105.7,329.24609375,3351.8671875
25,0.5255555555555556,2026-06-17 17:55:07.408860,2026-06-17 17:56:48.125026,0 days 00:01:40.716166,full,ZZFeatureMap,,2,0.5255555555555556,COMPLETE,25,ZZFeatureMap,2,full,,completed,,0.5409836065573771,0.532051282051282,0.5297619047619048,0.5255555555555556,0.532568306010929,59.742373100001714,40.96005680000235,105.6,329.33984375,4259.5546875
26,0.46840958605664484,2026-06-17 17:56:48.125026,2026-06-17 17:57:59.383070,0 days 00:01:11.258044,linear,PauliFeatureMap,"[""ZZ""]",3,0.46840958605664484,COMPLETE,26,PauliFeatureMap,3,linear,"[""ZZ""]",completed,,0.47540983606557374,0.4686813186813187,0.4691558441558441,0.46840958605664484,0.4734097646344513,42.332656799997494,28.91472629999771,109.0,328.58203125,4105.84765625
27,0.6142728093947606,2026-06-17 17:57:59.383070,2026-06-17 17:59:51.168998,0 days 00:01:51.785928,linear,PauliFeatureMap,"[""X"", ""Y"", ""Z""]",2,0.6142728093947606,COMPLETE,27,PauliFeatureMap,2,linear,"[""X"", ""Y"", ""Z""]",completed,,0.6557377049180327,0.6971153846153846,0.6331168831168831,0.6142728093947606,0.6246390332755786,66.52752739999414,45.24677360000351,208.3,329.62890625,3680.03515625
28,0.0,2026-06-17 17:59:51.168998,2026-06-17 17:59:51.171004,0 days 00:00:00.002006,circular,ZFeatureMap,,3,,COMPLETE,28,ZFeatureMap,3,circular,,failed,'NoneType' object has no attribute 'items',,,,,,,,,,
29,0.6950000000000001,2026-06-17 17:59:51.171511,2026-06-17 18:00:55.096581,0 days 00:01:03.925070,full,ZZFeatureMap,,1,0.6950000000000001,COMPLETE,29,ZZFeatureMap,1,full,,completed,,0.7049180327868853,0.7097902097902098,0.6948051948051948,0.6950000000000001,0.6995081967213115,38.03292609999335,25.8850706000012,108.6,329.43359375,3655.41015625
30,0.0,2026-06-17 18:00:55.096581,2026-06-17 18:00:55.098584,0 days 00:00:00.002003,linear,ZFeatureMap,,2,,COMPLETE,30,ZFeatureMap,2,linear,,failed,'NoneType' object has no attribute 'items',,,,,,,,,,
31,0.7201079622132254,2026-06-17 18:00:55.098584,2026-06-17 18:02:18.736125,0 days 00:01:23.637541,circular,ZZFeatureMap,,2,0.7201079622132254,COMPLETE,31,ZZFeatureMap,2,circular,,completed,,0.7213114754098361,0.7198275862068966,0.7207792207792207,0.7201079622132254,0.7216123537089888,49.88048930000514,33.74890370000503,116.4,329.48828125,3645.33984375
32,0.7201079622132254,2026-06-17 18:02:18.736125,2026-06-17 18:03:42.194784,0 days 00:01:23.458659,circular,ZZFeatureMap,,2,0.7201079622132254,COMPLETE,32,ZZFeatureMap,2,circular,,completed,,0.7213114754098361,0.7198275862068966,0.7207792207792207,0.7201079622132254,0.7216123537089888,49.665232400002424,33.78502440000011,103.9,329.65625,3627.08984375
33,0.7201079622132254,2026-06-17 18:03:42.194784,2026-06-17 18:05:05.687651,0 days 00:01:23.492867,circular,ZZFeatureMap,,2,0.7201079622132254,COMPLETE,33,ZZFeatureMap,2,circular,,completed,,0.7213114754098361,0.7198275862068966,0.7207792207792207,0.7201079622132254,0.7216123537089888,49.74848139999813,33.73718189999636,133.0,330.0546875,3626.33984375
34,0.7201079622132254,2026-06-17 18:05:05.689156,2026-06-17 18:06:29.303771,0 days 00:01:23.614615,circular,ZZFeatureMap,,2,0.7201079622132254,COMPLETE,34,ZZFeatureMap,2,circular,,completed,,0.7213114754098361,0.7198275862068966,0.7207792207792207,0.7201079622132254,0.7216123537089888,49.779211300003226,33.828302200003236,136.9,330.2421875,3627.83984375
35,0.7136150234741784,2026-06-17 18:06:29.303771,2026-06-17 18:07:24.040914,0 days 00:00:54.737143,circular,ZZFeatureMap,,1,0.7136150234741784,COMPLETE,35,ZZFeatureMap,1,circular,,completed,,0.7213114754098361,0.7248283752860412,0.7126623376623377,0.7136150234741784,0.7174632494420072,32.57413739999902,22.15661270000419,106.2,329.79296875,3627.83984375
36,0.5255555555555556,2026-06-17 18:07:24.040914,2026-06-17 18:09:04.567671,0 days 00:01:40.526757,full,ZZFeatureMap,,2,0.5255555555555556,COMPLETE,36,ZZFeatureMap,2,full,,completed,,0.5409836065573771,0.532051282051282,0.5297619047619048,0.5255555555555556,0.532568306010929,59.99753960000089,40.52118519999931,108.0,330.12890625,3628.58984375
37,0.6523744911804613,2026-06-17 18:09:04.567671,2026-06-17 18:09:54.900761,0 days 00:00:50.333090,linear,ZZFeatureMap,,1,0.6523744911804613,COMPLETE,37,ZZFeatureMap,1,linear,,completed,,0.6557377049180327,0.6530501089324618,0.652056277056277,0.6523744911804613,0.6551771692951042,30.059720799996285,20.267498699999123,195.3,330.65625,3627.83984375
38,0.0,2026-06-17 18:09:54.900761,2026-06-17 18:09:54.902761,0 days 00:00:00.002000,full,ZFeatureMap,,2,,COMPLETE,38,ZFeatureMap,2,full,,failed,'NoneType' object has no attribute 'items',,,,,,,,,,
39,0.8679653679653679,2026-06-17 18:09:54.902761,2026-06-17 18:10:47.263278,0 days 00:00:52.360517,linear,PauliFeatureMap,"[""X"", ""Z""]",1,0.8679653679653679,COMPLETE,39,PauliFeatureMap,1,linear,"[""X"", ""Z""]",completed,,0.8688524590163934,0.8679653679653679,0.8679653679653679,0.8679653679653679,0.8688524590163934,31.23443089999637,21.120893799998157,107.5,330.5859375,3627.83984375
