number,value,datetime_start,datetime_complete,duration,params_entanglement,params_feature_map_type,params_paulis,params_reps,user_attrs_macro_f1,state,trial_number,feature_map_type,reps,entanglement,paulis,status,error_message,accuracy,macro_precision,macro_recall,macro_f1,weighted_f1,fit_time_seconds,inference_time_seconds,peak_cpu_percent,peak_ram_mb,peak_gpu_memory_mb
0,0.5673758865248226,2026-05-16 18:25:20.069349,2026-05-16 18:27:26.230938,0 days 00:02:06.161589,linear,ZZFeatureMap,,2,0.5673758865248226,COMPLETE,0,ZZFeatureMap,2,linear,,completed,,0.5901639344262295,0.587092731829574,0.5752164502164502,0.5673758865248226,0.5755144750610394,75.17257029999746,50.98355089998222,120.2,315.7421875,1763.99609375
1,0.0,2026-05-16 18:27:26.230938,2026-05-16 18:27:26.231938,0 days 00:00:00.001000,linear,ZFeatureMap,,1,,COMPLETE,1,ZFeatureMap,1,linear,,failed,'NoneType' object has no attribute 'items',,,,,,,,,,
2,0.7441990494828068,2026-05-16 18:27:26.231938,2026-05-16 18:29:41.840858,0 days 00:02:15.608920,full,PauliFeatureMap,"[""Y"", ""Z""]",2,0.7441990494828068,COMPLETE,2,PauliFeatureMap,2,full,"[""Y"", ""Z""]",completed,,0.7540983606557377,0.7672619047619047,0.7429653679653679,0.7441990494828068,0.748323762471528,79.53611439999077,56.068544499983545,293.0,319.046875,1933.87109375
3,0.608974358974359,2026-05-16 18:29:41.840858,2026-05-16 18:32:35.583924,0 days 00:02:53.743066,full,ZZFeatureMap,,2,0.608974358974359,COMPLETE,3,ZZFeatureMap,2,full,,completed,,0.639344262295082,0.6548611111111111,0.6206709956709957,0.608974358974359,0.617906683480454,103.87141359999077,69.86752470000647,151.2,320.1640625,2285.32421875
4,0.0,2026-05-16 18:32:35.583924,2026-05-16 18:32:35.584924,0 days 00:00:00.001000,linear,ZFeatureMap,,1,,COMPLETE,4,ZFeatureMap,1,linear,,failed,'NoneType' object has no attribute 'items',,,,,,,,,,
5,0.6800699300699301,2026-05-16 18:32:35.584924,2026-05-16 18:33:57.550512,0 days 00:01:21.965588,linear,PauliFeatureMap,"[""Z"", ""ZZ""]",1,0.6800699300699301,COMPLETE,5,PauliFeatureMap,1,linear,"[""Z"", ""ZZ""]",completed,,0.7049180327868853,0.7395833333333333,0.6866883116883117,0.6800699300699301,0.687378195574917,48.92110209999373,33.04087029999937,105.9,319.30078125,1762.93359375
6,0.7288888888888889,2026-05-16 18:33:57.550512,2026-05-16 18:35:43.006980,0 days 00:01:45.456468,full,ZZFeatureMap,,1,0.7288888888888889,COMPLETE,6,ZZFeatureMap,1,full,,completed,,0.7377049180327869,0.7453379953379953,0.7278138528138528,0.7288888888888889,0.7328961748633881,62.48499280001852,42.96656439997605,116.4,319.55078125,1755.30859375
7,0.7288888888888889,2026-05-16 18:35:43.006980,2026-05-16 18:37:28.881025,0 days 00:01:45.874045,full,ZZFeatureMap,,1,0.7288888888888889,COMPLETE,7,ZZFeatureMap,1,full,,completed,,0.7377049180327869,0.7453379953379953,0.7278138528138528,0.7288888888888889,0.7328961748633881,63.57099290000042,42.29912830001558,116.4,319.56640625,1740.609375
8,0.6655122655122655,2026-05-16 18:37:28.881025,2026-05-16 18:38:59.321041,0 days 00:01:30.440016,circular,ZZFeatureMap,,1,0.6655122655122655,COMPLETE,8,ZZFeatureMap,1,circular,,completed,,0.6885245901639344,0.7118983957219251,0.6715367965367965,0.6655122655122655,0.6727036169659121,53.84219870000379,36.592382700007875,125.0,320.734375,1724.80859375
9,0.6161327231121281,2026-05-16 18:38:59.321041,2026-05-16 18:41:22.997057,0 days 00:02:23.676016,circular,ZZFeatureMap,,2,0.6161327231121281,COMPLETE,9,ZZFeatureMap,2,circular,,completed,,0.639344262295082,0.6472868217054264,0.6233766233766234,0.6161327231121281,0.6238699028397794,85.9727692999877,57.69930090001435,126.0,320.79296875,1893.57421875
10,0.7058156028368794,2026-05-16 18:41:22.998055,2026-05-16 18:44:28.489952,0 days 00:03:05.491897,full,PauliFeatureMap,"[""Y"", ""Z""]",3,0.7058156028368794,COMPLETE,10,PauliFeatureMap,3,full,"[""Y"", ""Z""]",completed,,0.7213114754098361,0.7399749373433584,0.7072510822510822,0.7058156028368794,0.7113498430415067,110.0708209000004,75.41561389999697,201.6,321.09375,1931.62890625
11,0.7058156028368794,2026-05-16 18:44:28.490955,2026-05-16 18:47:35.176802,0 days 00:03:06.685847,full,PauliFeatureMap,"[""Y"", ""Z""]",3,0.7058156028368794,COMPLETE,11,PauliFeatureMap,3,full,"[""Y"", ""Z""]",completed,,0.7213114754098361,0.7399749373433584,0.7072510822510822,0.7058156028368794,0.7113498430415067,112.0034733999928,74.67574159998912,208.3,321.38671875,1923.87109375
12,0.7288888888888889,2026-05-16 18:47:35.176802,2026-05-16 18:49:53.170530,0 days 00:02:17.993728,full,PauliFeatureMap,"[""X"", ""Z""]",2,0.7288888888888889,COMPLETE,12,PauliFeatureMap,2,full,"[""X"", ""Z""]",completed,,0.7377049180327869,0.7453379953379953,0.7278138528138528,0.7288888888888889,0.7328961748633881,82.03975609998452,55.948345999990124,208.3,322.0546875,1864.27734375
13,0.4912563895614743,2026-05-16 18:49:53.171528,2026-05-16 18:52:09.238616,0 days 00:02:16.067088,full,PauliFeatureMap,"[""ZZ""]",2,0.4912563895614743,COMPLETE,13,PauliFeatureMap,2,full,"[""ZZ""]",completed,,0.4918032786885246,0.49247311827956985,0.49242424242424243,0.4912563895614743,0.49262361237909996,81.49593860001187,54.565696400008164,121.9,321.25,1856.95703125
14,0.0,2026-05-16 18:52:09.238616,2026-05-16 18:52:09.241614,0 days 00:00:00.002998,full,ZFeatureMap,,3,,COMPLETE,14,ZFeatureMap,3,full,,failed,'NoneType' object has no attribute 'items',,,,,,,,,,
15,0.7288888888888889,2026-05-16 18:52:09.241614,2026-05-16 18:53:55.541472,0 days 00:01:46.299858,full,ZZFeatureMap,,1,0.7288888888888889,COMPLETE,15,ZZFeatureMap,1,full,,completed,,0.7377049180327869,0.7453379953379953,0.7278138528138528,0.7288888888888889,0.7328961748633881,63.59274839999853,42.700161000015214,293.0,322.734375,1788.32421875
16,0.6950000000000001,2026-05-16 18:53:55.542472,2026-05-16 18:57:09.617950,0 days 00:03:14.075478,circular,PauliFeatureMap,"[""X"", ""Y"", ""Z""]",2,0.6950000000000001,COMPLETE,16,PauliFeatureMap,2,circular,"[""X"", ""Y"", ""Z""]",completed,,0.7049180327868853,0.7097902097902098,0.6948051948051948,0.6950000000000001,0.6995081967213115,115.84111869998742,78.22790540001006,120.2,317.4453125,1758.98046875
17,0.6064516129032258,2026-05-16 18:57:09.618950,2026-05-16 18:58:50.440871,0 days 00:01:40.821921,full,PauliFeatureMap,"[""Z""]",3,0.6064516129032258,COMPLETE,17,PauliFeatureMap,3,full,"[""Z""]",completed,,0.6065573770491803,0.6088362068965517,0.6093073593073594,0.6064516129032258,0.6069804336329985,60.20428299999912,40.61188760001096,195.3,306.13671875,1720.23046875
18,0.7288888888888889,2026-05-16 18:58:50.440871,2026-05-16 19:00:37.882177,0 days 00:01:47.441306,full,ZZFeatureMap,,1,0.7288888888888889,COMPLETE,18,ZZFeatureMap,1,full,,completed,,0.7377049180327869,0.7453379953379953,0.7278138528138528,0.7288888888888889,0.7328961748633881,64.19564409999293,43.23957040000823,208.3,301.5546875,1881.35546875
19,0.0,2026-05-16 19:00:37.882177,2026-05-16 19:00:37.885177,0 days 00:00:00.003000,circular,ZFeatureMap,,2,,COMPLETE,19,ZFeatureMap,2,circular,,failed,'NoneType' object has no attribute 'items',,,,,,,,,,
20,0.7441990494828068,2026-05-16 19:00:37.885177,2026-05-16 19:02:54.993251,0 days 00:02:17.108074,full,PauliFeatureMap,"[""Y"", ""Z""]",2,0.7441990494828068,COMPLETE,20,PauliFeatureMap,2,full,"[""Y"", ""Z""]",completed,,0.7540983606557377,0.7672619047619047,0.7429653679653679,0.7441990494828068,0.748323762471528,81.8853558000119,55.2165943,195.3,302.3984375,1791.12109375
21,0.7441990494828068,2026-05-16 19:02:54.993251,2026-05-16 19:05:10.960635,0 days 00:02:15.967384,full,PauliFeatureMap,"[""Y"", ""Z""]",2,0.7441990494828068,COMPLETE,21,PauliFeatureMap,2,full,"[""Y"", ""Z""]",completed,,0.7540983606557377,0.7672619047619047,0.7429653679653679,0.7441990494828068,0.748323762471528,81.04538120000507,54.91642530000536,125.0,302.70703125,1771.71484375
22,0.7441990494828068,2026-05-16 19:05:10.961635,2026-05-16 19:07:27.097662,0 days 00:02:16.136027,full,PauliFeatureMap,"[""Y"", ""Z""]",2,0.7441990494828068,COMPLETE,22,PauliFeatureMap,2,full,"[""Y"", ""Z""]",completed,,0.7540983606557377,0.7672619047619047,0.7429653679653679,0.7441990494828068,0.748323762471528,81.26445990000502,54.86608239999623,293.0,297.49609375,1757.12109375
23,0.7441990494828068,2026-05-16 19:07:27.097662,2026-05-16 19:09:43.677183,0 days 00:02:16.579521,full,PauliFeatureMap,"[""Y"", ""Z""]",2,0.7441990494828068,COMPLETE,23,PauliFeatureMap,2,full,"[""Y"", ""Z""]",completed,,0.7540983606557377,0.7672619047619047,0.7429653679653679,0.7441990494828068,0.748323762471528,81.47328239999479,55.099621500005014,133.3,297.8828125,1866.18359375
24,0.7441990494828068,2026-05-16 19:09:43.678183,2026-05-16 19:12:01.119822,0 days 00:02:17.441639,full,PauliFeatureMap,"[""Y"", ""Z""]",2,0.7441990494828068,COMPLETE,24,PauliFeatureMap,2,full,"[""Y"", ""Z""]",completed,,0.7540983606557377,0.7672619047619047,0.7429653679653679,0.7441990494828068,0.748323762471528,81.57101889999467,55.864835399988806,195.3,293.11328125,1987.12109375
25,0.7441990494828068,2026-05-16 19:12:01.119822,2026-05-16 19:14:17.884239,0 days 00:02:16.764417,full,PauliFeatureMap,"[""Y"", ""Z""]",2,0.7441990494828068,COMPLETE,25,PauliFeatureMap,2,full,"[""Y"", ""Z""]",completed,,0.7540983606557377,0.7672619047619047,0.7429653679653679,0.7441990494828068,0.748323762471528,81.515287599992,55.24245320001501,208.3,293.6328125,2033.23046875
26,0.7058156028368794,2026-05-16 19:14:17.884239,2026-05-16 19:17:23.635077,0 days 00:03:05.750838,full,PauliFeatureMap,"[""Y"", ""Z""]",3,0.7058156028368794,COMPLETE,26,PauliFeatureMap,3,full,"[""Y"", ""Z""]",completed,,0.7213114754098361,0.7399749373433584,0.7072510822510822,0.7058156028368794,0.7113498430415067,110.97157920000609,74.77315360002103,208.3,293.390625,2062.89453125
27,0.4912563895614743,2026-05-16 19:17:23.635077,2026-05-16 19:19:38.791383,0 days 00:02:15.156306,full,PauliFeatureMap,"[""ZZ""]",2,0.4912563895614743,COMPLETE,27,PauliFeatureMap,2,full,"[""ZZ""]",completed,,0.4918032786885246,0.49247311827956985,0.49242424242424243,0.4912563895614743,0.49262361237909996,80.86278409999795,54.28708850001567,208.3,292.703125,1825.95703125
28,0.7288888888888889,2026-05-16 19:19:38.791383,2026-05-16 19:21:55.712328,0 days 00:02:16.920945,linear,PauliFeatureMap,"[""X"", ""Z""]",2,0.7288888888888889,COMPLETE,28,PauliFeatureMap,2,linear,"[""X"", ""Z""]",completed,,0.7377049180327869,0.7453379953379953,0.7278138528138528,0.7288888888888889,0.7328961748633881,81.82167820000905,55.092268500011414,201.6,291.40625,1797.84765625
29,0.43723790886217495,2026-05-16 19:21:55.712856,2026-05-16 19:25:12.908217,0 days 00:03:17.195361,circular,PauliFeatureMap,"[""Z"", ""ZZ""]",3,0.43723790886217495,COMPLETE,29,PauliFeatureMap,3,circular,"[""Z"", ""ZZ""]",completed,,0.45901639344262296,0.44047619047619047,0.4458874458874459,0.43723790886217495,0.4463122774373616,117.04512659998727,80.1443261000095,116.4,291.96875,1831.28515625
30,0.6854816824966079,2026-05-16 19:25:12.908217,2026-05-16 19:26:32.162455,0 days 00:01:19.254238,linear,PauliFeatureMap,"[""Z""]",2,0.6854816824966079,COMPLETE,30,PauliFeatureMap,2,linear,"[""Z""]",completed,,0.6885245901639344,0.6862745098039216,0.6850649350649352,0.6854816824966079,0.6880174388860466,47.13438410000526,32.11290440001176,312.5,290.55859375,1749.03515625
31,0.7441990494828068,2026-05-16 19:26:32.162994,2026-05-16 19:28:49.410802,0 days 00:02:17.247808,full,PauliFeatureMap,"[""Y"", ""Z""]",2,0.7441990494828068,COMPLETE,31,PauliFeatureMap,2,full,"[""Y"", ""Z""]",completed,,0.7540983606557377,0.7672619047619047,0.7429653679653679,0.7441990494828068,0.748323762471528,81.64360250000027,55.59821649998776,126.0,290.87890625,1799.18359375
32,0.7441990494828068,2026-05-16 19:28:49.410802,2026-05-16 19:31:06.448823,0 days 00:02:17.038021,full,PauliFeatureMap,"[""Y"", ""Z""]",2,0.7441990494828068,COMPLETE,32,PauliFeatureMap,2,full,"[""Y"", ""Z""]",completed,,0.7540983606557377,0.7672619047619047,0.7429653679653679,0.7441990494828068,0.748323762471528,81.72894309999538,55.30256680000457,112.5,287.359375,1805.68359375
33,0.7441990494828068,2026-05-16 19:31:06.448823,2026-05-16 19:33:23.933000,0 days 00:02:17.484177,full,PauliFeatureMap,"[""Y"", ""Z""]",2,0.7441990494828068,COMPLETE,33,PauliFeatureMap,2,full,"[""Y"", ""Z""]",completed,,0.7540983606557377,0.7672619047619047,0.7429653679653679,0.7441990494828068,0.748323762471528,81.84512309997808,55.63216530001955,112.5,287.5859375,1764.43359375
34,0.0,2026-05-16 19:33:23.933000,2026-05-16 19:33:23.935999,0 days 00:00:00.002999,full,ZFeatureMap,,2,,COMPLETE,34,ZFeatureMap,2,full,,failed,'NoneType' object has no attribute 'items',,,,,,,,,,
35,0.6950000000000001,2026-05-16 19:33:23.935999,2026-05-16 19:36:39.466128,0 days 00:03:15.530129,linear,PauliFeatureMap,"[""X"", ""Y"", ""Z""]",2,0.6950000000000001,COMPLETE,35,PauliFeatureMap,2,linear,"[""X"", ""Y"", ""Z""]",completed,,0.7049180327868853,0.7097902097902098,0.6948051948051948,0.6950000000000001,0.6995081967213115,116.61378850002075,78.91053039999679,146.5,284.8828125,1935.62890625
36,0.0,2026-05-16 19:36:39.466128,2026-05-16 19:36:39.469601,0 days 00:00:00.003473,full,ZFeatureMap,,2,,COMPLETE,36,ZFeatureMap,2,full,,failed,'NoneType' object has no attribute 'items',,,,,,,,,,
37,0.7441990494828068,2026-05-16 19:36:39.469601,2026-05-16 19:38:55.779130,0 days 00:02:16.309529,full,PauliFeatureMap,"[""Y"", ""Z""]",2,0.7441990494828068,COMPLETE,37,PauliFeatureMap,2,full,"[""Y"", ""Z""]",completed,,0.7540983606557377,0.7672619047619047,0.7429653679653679,0.7441990494828068,0.748323762471528,81.14763350001886,55.155635299975984,109.6,285.33984375,1940.27734375
38,0.7966666666666666,2026-05-16 19:38:55.779130,2026-05-16 19:40:22.708447,0 days 00:01:26.929317,linear,PauliFeatureMap,"[""Y"", ""Z""]",1,0.7966666666666666,COMPLETE,38,PauliFeatureMap,1,linear,"[""Y"", ""Z""]",completed,,0.8032786885245902,0.8164335664335665,0.7938311688311688,0.7966666666666666,0.799672131147541,51.45674900000449,35.46606440001051,103.9,285.22265625,2221.78515625
39,0.7966666666666666,2026-05-16 19:40:22.708447,2026-05-16 19:41:48.777021,0 days 00:01:26.068574,linear,PauliFeatureMap,"[""Y"", ""Z""]",1,0.7966666666666666,COMPLETE,39,PauliFeatureMap,1,linear,"[""Y"", ""Z""]",completed,,0.8032786885245902,0.8164335664335665,0.7938311688311688,0.7966666666666666,0.799672131147541,51.56326299998909,34.4994246000133,112.0,285.20703125,1985.78515625
