number,value,datetime_start,datetime_complete,duration,params_entanglement,params_feature_map_type,params_paulis,params_reps,user_attrs_macro_f1,state,trial_number,feature_map_type,reps,entanglement,paulis,status,error_message,accuracy,macro_precision,macro_recall,macro_f1,weighted_f1,fit_time_seconds,inference_time_seconds,peak_cpu_percent,peak_ram_mb,peak_gpu_memory_mb
0,0.7525247758376593,2026-05-16 10:57:10.536652,2026-05-16 11:00:48.144997,0 days 00:03:37.608345,linear,ZZFeatureMap,,2,0.7525247758376593,COMPLETE,0,ZZFeatureMap,2,linear,,completed,,0.7982456140350878,0.857707509881423,0.7371437929905011,0.7525247758376593,0.7786509690933326,129.93039105273783,87.67531008599326,415.4,571.7109375,
1,0.0,2026-05-16 11:00:48.146986,2026-05-16 11:00:48.148173,0 days 00:00:00.001187,linear,ZFeatureMap,,1,,COMPLETE,1,ZFeatureMap,1,linear,,failed,'NoneType' object has no attribute 'items',,,,,,,,,,
2,0.9434523809523809,2026-05-16 11:00:48.148651,2026-05-16 11:04:37.662856,0 days 00:03:49.514205,full,PauliFeatureMap,"[""Y"", ""Z""]",2,0.9434523809523809,COMPLETE,2,PauliFeatureMap,2,full,"[""Y"", ""Z""]",completed,,0.9473684210526315,0.9482124958235884,0.9394038650507697,0.9434523809523809,0.947107351712615,137.67034645192325,91.84166867099702,581.3,575.46875,
3,0.6289330922242314,2026-05-16 11:04:37.664821,2026-05-16 11:09:19.325266,0 days 00:04:41.660445,full,ZZFeatureMap,,2,0.6289330922242314,COMPLETE,3,ZZFeatureMap,2,full,,completed,,0.6842105263157895,0.665389527458493,0.6272518833933836,0.6289330922242314,0.6641096411915866,167.33618401410058,114.32180760381743,585.8,576.078125,
4,0.0,2026-05-16 11:09:19.327937,2026-05-16 11:09:19.328539,0 days 00:00:00.000602,linear,ZFeatureMap,,1,,COMPLETE,4,ZFeatureMap,1,linear,,failed,'NoneType' object has no attribute 'items',,,,,,,,,,
5,0.8492063492063492,2026-05-16 11:09:19.329034,2026-05-16 11:11:46.606958,0 days 00:02:27.277924,linear,PauliFeatureMap,"[""Z"", ""ZZ""]",1,0.8492063492063492,COMPLETE,5,PauliFeatureMap,1,linear,"[""Z"", ""ZZ""]",completed,,0.8596491228070176,0.852990310725025,0.846053062561415,0.8492063492063492,0.8589529379003062,88.28841015510261,58.98581114690751,511.2,575.11328125,
6,0.857914416285833,2026-05-16 11:11:46.608283,2026-05-16 11:14:54.032565,0 days 00:03:07.424282,full,ZZFeatureMap,,1,0.857914416285833,COMPLETE,6,ZZFeatureMap,1,full,,completed,,0.868421052631579,0.8641891891891892,0.8530953160825417,0.857914416285833,0.8674042813723132,112.2357255667448,75.18640016019344,161.5,576.81640625,
7,0.857914416285833,2026-05-16 11:14:54.034207,2026-05-16 11:18:02.286085,0 days 00:03:08.251878,full,ZZFeatureMap,,1,0.857914416285833,COMPLETE,7,ZZFeatureMap,1,full,,completed,,0.868421052631579,0.8641891891891892,0.8530953160825417,0.857914416285833,0.8674042813723132,113.26435550209135,74.98525345604867,261.6,577.48046875,
8,0.8372385991433611,2026-05-16 11:18:02.288117,2026-05-16 11:20:40.075288,0 days 00:02:37.787171,circular,ZZFeatureMap,,1,0.8372385991433611,COMPLETE,8,ZZFeatureMap,1,circular,,completed,,0.8508771929824561,0.8486842105263157,0.8298395021290534,0.8372385991433611,0.848810739370472,94.582362272311,63.202633928041905,142.8,577.19140625,
9,0.7481219619973487,2026-05-16 11:20:40.077305,2026-05-16 11:24:38.927907,0 days 00:03:58.850602,circular,ZZFeatureMap,,2,0.7481219619973487,COMPLETE,9,ZZFeatureMap,2,circular,,completed,,0.7807017543859649,0.786904761904762,0.7368162463150999,0.7481219619973487,0.7703715763115256,143.87147393776104,94.97654027910903,260.8,577.72265625,
10,0.8934669951575906,2026-05-16 11:24:38.929760,2026-05-16 11:29:45.011713,0 days 00:05:06.081953,full,PauliFeatureMap,"[""Y"", ""Z""]",3,0.8934669951575906,COMPLETE,10,PauliFeatureMap,3,full,"[""Y"", ""Z""]",completed,,0.9035087719298246,0.9145299145299145,0.8812643301670489,0.8934669951575906,0.9015004165753777,184.9406602117233,121.13772077811882,318.9,577.9609375,
11,0.8934669951575906,2026-05-16 11:29:45.012523,2026-05-16 11:34:47.618182,0 days 00:05:02.605659,full,PauliFeatureMap,"[""Y"", ""Z""]",3,0.8934669951575906,COMPLETE,11,PauliFeatureMap,3,full,"[""Y"", ""Z""]",completed,,0.9035087719298246,0.9145299145299145,0.8812643301670489,0.8934669951575906,0.9015004165753777,181.8876126371324,120.71346957515925,445.9,578.55859375,
12,0.8934669951575906,2026-05-16 11:34:47.620237,2026-05-16 11:39:51.416145,0 days 00:05:03.795908,full,PauliFeatureMap,"[""Y"", ""Z""]",3,0.8934669951575906,COMPLETE,12,PauliFeatureMap,3,full,"[""Y"", ""Z""]",completed,,0.9035087719298246,0.9145299145299145,0.8812643301670489,0.8934669951575906,0.9015004165753777,180.88607976213098,122.90382366906852,345.6,579.5,
13,0.5017482517482518,2026-05-16 11:39:51.418276,2026-05-16 11:44:56.629724,0 days 00:05:05.211448,full,PauliFeatureMap,"[""ZZ""]",3,0.5017482517482518,COMPLETE,13,PauliFeatureMap,3,full,"[""ZZ""]",completed,,0.6491228070175439,0.6571428571428571,0.5486406812970848,0.5017482517482518,0.5683045025150287,182.49365092394873,122.71093439823017,202.0,578.49609375,
14,0.9088874680306905,2026-05-16 11:44:56.630536,2026-05-16 11:47:49.333608,0 days 00:02:52.703072,full,PauliFeatureMap,"[""Z""]",3,0.9088874680306905,COMPLETE,14,PauliFeatureMap,3,full,"[""Z""]",completed,,0.9122807017543859,0.9029827315541601,0.9204061578774976,0.9088874680306905,0.9132061291335756,103.47335066599771,69.22335138218477,108.5,578.66015625,
15,0.9531057178116001,2026-05-16 11:47:49.336801,2026-05-16 11:50:10.291797,0 days 00:02:20.954996,full,PauliFeatureMap,"[""Z""]",2,0.9531057178116001,COMPLETE,15,PauliFeatureMap,2,full,"[""Z""]",completed,,0.956140350877193,0.9553571428571428,0.9510317720275139,0.9531057178116001,0.9560357083576898,84.33600042993203,56.61501189973205,134.3,579.9609375,
16,0.8353580834253674,2026-05-16 11:50:10.293729,2026-05-16 11:55:24.493083,0 days 00:05:14.199354,circular,PauliFeatureMap,"[""X"", ""Y"", ""Z""]",2,0.8353580834253674,COMPLETE,16,PauliFeatureMap,2,circular,"[""X"", ""Y"", ""Z""]",completed,,0.8508771929824561,0.8536324786324787,0.825253848673436,0.8353580834253674,0.8477733710710385,188.02083410695195,126.17440266907215,201.7,579.71875,
17,0.9074675324675325,2026-05-16 11:55:24.495194,2026-05-16 11:59:15.137792,0 days 00:03:50.642598,full,PauliFeatureMap,"[""X"", ""Z""]",2,0.9074675324675325,COMPLETE,17,PauliFeatureMap,2,full,"[""X"", ""Z""]",completed,,0.9122807017543859,0.9043478260869565,0.9112348509662627,0.9074675324675325,0.9126509455456824,137.9437393983826,92.69304181076586,313.3,580.0546875,
18,0.0,2026-05-16 11:59:15.138570,2026-05-16 11:59:15.142268,0 days 00:00:00.003698,full,ZFeatureMap,,2,,COMPLETE,18,ZFeatureMap,2,full,,failed,'NoneType' object has no attribute 'items',,,,,,,,,,
19,0.9531057178116001,2026-05-16 11:59:15.142845,2026-05-16 12:01:37.595301,0 days 00:02:22.452456,circular,PauliFeatureMap,"[""Z""]",2,0.9531057178116001,COMPLETE,19,PauliFeatureMap,2,circular,"[""Z""]",completed,,0.956140350877193,0.9553571428571428,0.9510317720275139,0.9531057178116001,0.9560357083576898,85.4195436318405,57.02963787224144,105.1,579.33984375,
20,0.9531057178116001,2026-05-16 12:01:37.596100,2026-05-16 12:04:00.791115,0 days 00:02:23.195015,circular,PauliFeatureMap,"[""Z""]",2,0.9531057178116001,COMPLETE,20,PauliFeatureMap,2,circular,"[""Z""]",completed,,0.956140350877193,0.9553571428571428,0.9510317720275139,0.9531057178116001,0.9560357083576898,85.60380546469241,57.586590697057545,108.6,580.3359375,
21,0.9531057178116001,2026-05-16 12:04:00.793201,2026-05-16 12:06:23.006478,0 days 00:02:22.213277,circular,PauliFeatureMap,"[""Z""]",2,0.9531057178116001,COMPLETE,21,PauliFeatureMap,2,circular,"[""Z""]",completed,,0.956140350877193,0.9553571428571428,0.9510317720275139,0.9531057178116001,0.9560357083576898,85.18819780182093,57.01976457005367,104.8,580.79296875,
22,0.9531057178116001,2026-05-16 12:06:23.007349,2026-05-16 12:08:44.784010,0 days 00:02:21.776661,circular,PauliFeatureMap,"[""Z""]",2,0.9531057178116001,COMPLETE,22,PauliFeatureMap,2,circular,"[""Z""]",completed,,0.956140350877193,0.9553571428571428,0.9510317720275139,0.9531057178116001,0.9560357083576898,85.05193797172979,56.71783735509962,131.3,581.41796875,
23,0.9531057178116001,2026-05-16 12:08:44.786190,2026-05-16 12:11:05.754712,0 days 00:02:20.968522,circular,PauliFeatureMap,"[""Z""]",2,0.9531057178116001,COMPLETE,23,PauliFeatureMap,2,circular,"[""Z""]",completed,,0.956140350877193,0.9553571428571428,0.9510317720275139,0.9531057178116001,0.9560357083576898,84.50676478585228,56.45572272269055,103.7,581.6796875,
24,0.9531057178116001,2026-05-16 12:11:05.757175,2026-05-16 12:13:27.258862,0 days 00:02:21.501687,circular,PauliFeatureMap,"[""Z""]",2,0.9531057178116001,COMPLETE,24,PauliFeatureMap,2,circular,"[""Z""]",completed,,0.956140350877193,0.9553571428571428,0.9510317720275139,0.9531057178116001,0.9560357083576898,84.92295354511589,56.57507391599938,153.4,581.10546875,
25,0.0,2026-05-16 12:13:27.261002,2026-05-16 12:13:27.263448,0 days 00:00:00.002446,circular,ZFeatureMap,,2,,COMPLETE,25,ZFeatureMap,2,circular,,failed,'NoneType' object has no attribute 'items',,,,,,,,,,
26,0.9088874680306905,2026-05-16 12:13:27.264070,2026-05-16 12:16:19.581398,0 days 00:02:52.317328,circular,PauliFeatureMap,"[""Z""]",3,0.9088874680306905,COMPLETE,26,PauliFeatureMap,3,circular,"[""Z""]",completed,,0.9122807017543859,0.9029827315541601,0.9204061578774976,0.9088874680306905,0.9132061291335756,103.26486909901723,69.04758837493137,238.6,580.5703125,
27,0.9531057178116001,2026-05-16 12:16:19.583593,2026-05-16 12:18:41.684166,0 days 00:02:22.100573,circular,PauliFeatureMap,"[""Z""]",2,0.9531057178116001,COMPLETE,27,PauliFeatureMap,2,circular,"[""Z""]",completed,,0.956140350877193,0.9553571428571428,0.9510317720275139,0.9531057178116001,0.9560357083576898,85.10812402609736,56.9867191570811,794.4,580.71875,
28,0.8353580834253674,2026-05-16 12:18:41.686366,2026-05-16 12:23:56.921831,0 days 00:05:15.235465,circular,PauliFeatureMap,"[""X"", ""Y"", ""Z""]",2,0.8353580834253674,COMPLETE,28,PauliFeatureMap,2,circular,"[""X"", ""Y"", ""Z""]",completed,,0.8508771929824561,0.8536324786324787,0.825253848673436,0.8353580834253674,0.8477733710710385,188.6449238397181,126.58384270314127,442.7,581.58203125,
29,0.0,2026-05-16 12:23:56.923344,2026-05-16 12:23:56.925258,0 days 00:00:00.001914,linear,ZFeatureMap,,2,,COMPLETE,29,ZFeatureMap,2,linear,,failed,'NoneType' object has no attribute 'items',,,,,,,,,,
30,0.7481219619973487,2026-05-16 12:23:56.925868,2026-05-16 12:27:58.414103,0 days 00:04:01.488235,circular,PauliFeatureMap,"[""Z"", ""ZZ""]",2,0.7481219619973487,COMPLETE,30,PauliFeatureMap,2,circular,"[""Z"", ""ZZ""]",completed,,0.7807017543859649,0.786904761904762,0.7368162463150999,0.7481219619973487,0.7703715763115256,144.60996673814952,96.87484999466687,291.6,580.234375,
31,0.9531057178116001,2026-05-16 12:27:58.416264,2026-05-16 12:30:20.451870,0 days 00:02:22.035606,circular,PauliFeatureMap,"[""Z""]",2,0.9531057178116001,COMPLETE,31,PauliFeatureMap,2,circular,"[""Z""]",completed,,0.956140350877193,0.9553571428571428,0.9510317720275139,0.9531057178116001,0.9560357083576898,85.19984568795189,56.828907074872404,111.3,580.48046875,
32,0.9531057178116001,2026-05-16 12:30:20.453911,2026-05-16 12:32:42.315141,0 days 00:02:21.861230,circular,PauliFeatureMap,"[""Z""]",2,0.9531057178116001,COMPLETE,32,PauliFeatureMap,2,circular,"[""Z""]",completed,,0.956140350877193,0.9553571428571428,0.9510317720275139,0.9531057178116001,0.9560357083576898,84.8081498411484,57.049452282022685,233.0,581.11328125,
33,0.9531057178116001,2026-05-16 12:32:42.317294,2026-05-16 12:35:04.865037,0 days 00:02:22.547743,circular,PauliFeatureMap,"[""Z""]",2,0.9531057178116001,COMPLETE,33,PauliFeatureMap,2,circular,"[""Z""]",completed,,0.956140350877193,0.9553571428571428,0.9510317720275139,0.9531057178116001,0.9560357083576898,85.42702038865536,57.11539820302278,124.0,580.78125,
34,0.9074675324675325,2026-05-16 12:35:04.866966,2026-05-16 12:38:55.813303,0 days 00:03:50.946337,linear,PauliFeatureMap,"[""X"", ""Z""]",2,0.9074675324675325,COMPLETE,34,PauliFeatureMap,2,linear,"[""X"", ""Z""]",completed,,0.9122807017543859,0.9043478260869565,0.9112348509662627,0.9074675324675325,0.9126509455456824,139.2954479767941,91.64727585902438,271.0,581.3671875,
35,0.7014590347923682,2026-05-16 12:38:55.815416,2026-05-16 12:40:56.285822,0 days 00:02:00.470406,circular,PauliFeatureMap,"[""ZZ""]",1,0.7014590347923682,COMPLETE,35,PauliFeatureMap,1,circular,"[""ZZ""]",completed,,0.7543859649122807,0.7811753463927378,0.6927612184736325,0.7014590347923682,0.7323330773623171,72.12287262594327,48.343822970986366,156.3,581.6640625,
36,0.0,2026-05-16 12:40:56.287847,2026-05-16 12:40:56.290575,0 days 00:00:00.002728,linear,ZFeatureMap,,2,,COMPLETE,36,ZFeatureMap,2,linear,,failed,'NoneType' object has no attribute 'items',,,,,,,,,,
37,0.942866688940862,2026-05-16 12:40:56.291205,2026-05-16 12:42:46.200026,0 days 00:01:49.908821,circular,PauliFeatureMap,"[""Z""]",1,0.942866688940862,COMPLETE,37,PauliFeatureMap,1,circular,"[""Z""]",completed,,0.9473684210526315,0.9538461538461538,0.9348182115951523,0.942866688940862,0.9468057045386604,65.87540471833199,44.02871820004657,106.9,581.68359375,
38,0.7481219619973487,2026-05-16 12:42:46.202170,2026-05-16 12:46:47.001071,0 days 00:04:00.798901,circular,ZZFeatureMap,,2,0.7481219619973487,COMPLETE,38,ZZFeatureMap,2,circular,,completed,,0.7807017543859649,0.786904761904762,0.7368162463150999,0.7481219619973487,0.7703715763115256,143.6327933720313,97.16255310503766,114.1,581.953125,
39,0.942866688940862,2026-05-16 12:46:47.003213,2026-05-16 12:48:36.875988,0 days 00:01:49.872775,linear,PauliFeatureMap,"[""Z""]",1,0.942866688940862,COMPLETE,39,PauliFeatureMap,1,linear,"[""Z""]",completed,,0.9473684210526315,0.9538461538461538,0.9348182115951523,0.942866688940862,0.9468057045386604,65.74900095211342,44.119815590791404,224.6,582.21484375,
