number,value,datetime_start,datetime_complete,duration,params_entanglement,params_feature_map_type,params_paulis,params_reps,user_attrs_macro_f1,state,trial_number,feature_map_type,reps,entanglement,paulis,status,error_message,accuracy,macro_precision,macro_recall,macro_f1,weighted_f1,fit_time_seconds,inference_time_seconds,peak_cpu_percent,peak_ram_mb,peak_gpu_memory_mb
0,0.6727890106497916,2026-05-16 10:17:27.877802,2026-05-16 10:17:48.337412,0 days 00:00:20.459610,linear,ZZFeatureMap,,2,0.6727890106497916,COMPLETE,0,ZZFeatureMap,2,linear,,completed,,0.6666666666666666,0.6886710239651416,0.6658730158730158,0.6727890106497916,0.6676956320419818,12.154384250752628,8.30241229198873,104.8,257.203125,
1,0.0,2026-05-16 10:17:48.338116,2026-05-16 10:17:48.339756,0 days 00:00:00.001640,linear,ZFeatureMap,,1,,COMPLETE,1,ZFeatureMap,1,linear,,failed,'NoneType' object has no attribute 'items',,,,,,,,,,
2,0.7797077474496829,2026-05-16 10:17:48.340227,2026-05-16 10:18:09.999698,0 days 00:00:21.659471,full,PauliFeatureMap,"[""Y"", ""Z""]",2,0.7797077474496829,COMPLETE,2,PauliFeatureMap,2,full,"[""Y"", ""Z""]",completed,,0.8055555555555556,0.84593837535014,0.7777777777777778,0.7797077474496829,0.7928499218821798,12.773811281193048,8.883698008023202,158.4,260.5625,
3,0.411764705882353,2026-05-16 10:18:10.000358,2026-05-16 10:18:36.827761,0 days 00:00:26.827403,full,ZZFeatureMap,,2,0.411764705882353,COMPLETE,3,ZZFeatureMap,2,full,,completed,,0.4444444444444444,0.4197994987468672,0.41984126984126985,0.411764705882353,0.42899584076054664,15.845421246718615,10.9764194493182,189.4,261.7734375,
4,0.0,2026-05-16 10:18:36.829914,2026-05-16 10:18:36.830459,0 days 00:00:00.000545,linear,ZFeatureMap,,1,,COMPLETE,4,ZFeatureMap,1,linear,,failed,'NoneType' object has no attribute 'items',,,,,,,,,,
5,0.7265221878224973,2026-05-16 10:18:36.830945,2026-05-16 10:18:50.835331,0 days 00:00:14.004386,linear,PauliFeatureMap,"[""Z"", ""ZZ""]",1,0.7265221878224973,COMPLETE,5,PauliFeatureMap,1,linear,"[""Z"", ""ZZ""]",completed,,0.7222222222222222,0.7925925925925926,0.7134920634920635,0.7265221878224973,0.7248022015823873,8.308575003873557,5.693886043038219,147.6,262.48046875,
6,0.690665419978183,2026-05-16 10:18:50.836010,2026-05-16 10:19:08.477159,0 days 00:00:17.641149,full,ZZFeatureMap,,1,0.690665419978183,COMPLETE,6,ZZFeatureMap,1,full,,completed,,0.6944444444444444,0.7081105169340464,0.684126984126984,0.690665419978183,0.693054906238637,10.559533790219575,7.079631172120571,294.2,262.48046875,
7,0.690665419978183,2026-05-16 10:19:08.477865,2026-05-16 10:19:25.840410,0 days 00:00:17.362545,full,ZZFeatureMap,,1,0.690665419978183,COMPLETE,7,ZZFeatureMap,1,full,,completed,,0.6944444444444444,0.7081105169340464,0.684126984126984,0.690665419978183,0.693054906238637,10.258889944292605,7.101677438709885,108.7,262.48828125,
8,0.659370648844333,2026-05-16 10:19:25.841092,2026-05-16 10:19:40.916253,0 days 00:00:15.075161,circular,ZZFeatureMap,,1,0.659370648844333,COMPLETE,8,ZZFeatureMap,1,circular,,completed,,0.6666666666666666,0.7275132275132274,0.6579365079365079,0.659370648844333,0.6565302144249512,8.983500110916793,6.089686526916921,543.1,262.48828125,
9,0.572192513368984,2026-05-16 10:19:40.918164,2026-05-16 10:20:03.575944,0 days 00:00:22.657780,circular,ZZFeatureMap,,2,0.572192513368984,COMPLETE,9,ZZFeatureMap,2,circular,,completed,,0.6111111111111112,0.5867167919799499,0.5801587301587302,0.572192513368984,0.5929887106357695,13.395193034783006,9.260508958715945,110.6,262.4921875,
10,0.8064160401002506,2026-05-16 10:20:03.576602,2026-05-16 10:20:32.150741,0 days 00:00:28.574139,full,PauliFeatureMap,"[""Y"", ""Z""]",3,0.8064160401002506,COMPLETE,10,PauliFeatureMap,3,full,"[""Y"", ""Z""]",completed,,0.8055555555555556,0.8127798127798127,0.8023809523809525,0.8064160401002506,0.807251461988304,16.96249599987641,11.606314754113555,172.1,262.578125,
11,0.8064160401002506,2026-05-16 10:20:32.151412,2026-05-16 10:21:01.010500,0 days 00:00:28.859088,full,PauliFeatureMap,"[""Y"", ""Z""]",3,0.8064160401002506,COMPLETE,11,PauliFeatureMap,3,full,"[""Y"", ""Z""]",completed,,0.8055555555555556,0.8127798127798127,0.8023809523809525,0.8064160401002506,0.807251461988304,17.12784099113196,11.72600122122094,104.5,262.578125,
12,0.8064160401002506,2026-05-16 10:21:01.011218,2026-05-16 10:21:29.485068,0 days 00:00:28.473850,full,PauliFeatureMap,"[""Y"", ""Z""]",3,0.8064160401002506,COMPLETE,12,PauliFeatureMap,3,full,"[""Y"", ""Z""]",completed,,0.8055555555555556,0.8127798127798127,0.8023809523809525,0.8064160401002506,0.807251461988304,16.955657684709877,11.51393588539213,111.8,262.578125,
13,0.37210338680926913,2026-05-16 10:21:29.485794,2026-05-16 10:21:58.233294,0 days 00:00:28.747500,full,PauliFeatureMap,"[""ZZ""]",3,0.37210338680926913,COMPLETE,13,PauliFeatureMap,3,full,"[""ZZ""]",completed,,0.3888888888888889,0.39444444444444443,0.37222222222222223,0.37210338680926913,0.3810903149138443,17.079829981084913,11.661579105071723,107.2,262.58984375,
14,0.6313372195725137,2026-05-16 10:21:58.235221,2026-05-16 10:22:14.540024,0 days 00:00:16.304803,full,PauliFeatureMap,"[""Z""]",3,0.6313372195725137,COMPLETE,14,PauliFeatureMap,3,full,"[""Z""]",completed,,0.6666666666666666,0.7195652173913043,0.6444444444444444,0.6313372195725137,0.6363422245775188,9.719177979975939,6.582478180062026,105.2,262.58984375,
15,0.8064160401002506,2026-05-16 10:22:14.540783,2026-05-16 10:22:42.800417,0 days 00:00:28.259634,full,PauliFeatureMap,"[""Y"", ""Z""]",3,0.8064160401002506,COMPLETE,15,PauliFeatureMap,3,full,"[""Y"", ""Z""]",completed,,0.8055555555555556,0.8127798127798127,0.8023809523809525,0.8064160401002506,0.807251461988304,16.84733213391155,11.407958373893052,289.8,262.59375,
16,0.8580827067669173,2026-05-16 10:22:42.801184,2026-05-16 10:23:22.840295,0 days 00:00:40.039111,circular,PauliFeatureMap,"[""X"", ""Y"", ""Z""]",3,0.8580827067669173,COMPLETE,16,PauliFeatureMap,3,circular,"[""X"", ""Y"", ""Z""]",completed,,0.8611111111111112,0.8888888888888888,0.85,0.8580827067669173,0.8599101921470341,23.7940788064152,16.239502139389515,278.3,263.9453125,
17,0.8580827067669173,2026-05-16 10:23:22.841121,2026-05-16 10:24:02.515321,0 days 00:00:39.674200,circular,PauliFeatureMap,"[""X"", ""Y"", ""Z""]",3,0.8580827067669173,COMPLETE,17,PauliFeatureMap,3,circular,"[""X"", ""Y"", ""Z""]",completed,,0.8611111111111112,0.8888888888888888,0.85,0.8580827067669173,0.8599101921470341,23.55002136575058,16.11859959596768,972.3,263.9609375,
18,0.0,2026-05-16 10:24:02.516091,2026-05-16 10:24:02.520700,0 days 00:00:00.004609,circular,ZFeatureMap,,3,,COMPLETE,18,ZFeatureMap,3,circular,,failed,'NoneType' object has no attribute 'items',,,,,,,,,,
19,0.4753086419753086,2026-05-16 10:24:02.521697,2026-05-16 10:24:31.444107,0 days 00:00:28.922410,circular,PauliFeatureMap,"[""X"", ""Y"", ""Z""]",2,0.4753086419753086,COMPLETE,19,PauliFeatureMap,2,circular,"[""X"", ""Y"", ""Z""]",completed,,0.5555555555555556,0.5374269005847953,0.5174603174603175,0.4753086419753086,0.5030864197530864,17.195775330998003,11.722360557876527,143.7,264.12109375,
20,0.8580827067669173,2026-05-16 10:24:31.444948,2026-05-16 10:25:11.085802,0 days 00:00:39.640854,circular,PauliFeatureMap,"[""X"", ""Y"", ""Z""]",3,0.8580827067669173,COMPLETE,20,PauliFeatureMap,3,circular,"[""X"", ""Y"", ""Z""]",completed,,0.8611111111111112,0.8888888888888888,0.85,0.8580827067669173,0.8599101921470341,23.644021881744266,15.990614007227123,171.3,264.125,
21,0.8580827067669173,2026-05-16 10:25:11.086589,2026-05-16 10:25:51.108190,0 days 00:00:40.021601,circular,PauliFeatureMap,"[""X"", ""Y"", ""Z""]",3,0.8580827067669173,COMPLETE,21,PauliFeatureMap,3,circular,"[""X"", ""Y"", ""Z""]",completed,,0.8611111111111112,0.8888888888888888,0.85,0.8580827067669173,0.8599101921470341,23.73669085977599,16.280689460691065,119.3,264.2265625,
22,0.8580827067669173,2026-05-16 10:25:51.109025,2026-05-16 10:26:31.060364,0 days 00:00:39.951339,circular,PauliFeatureMap,"[""X"", ""Y"", ""Z""]",3,0.8580827067669173,COMPLETE,22,PauliFeatureMap,3,circular,"[""X"", ""Y"", ""Z""]",completed,,0.8611111111111112,0.8888888888888888,0.85,0.8580827067669173,0.8599101921470341,23.736479276791215,16.21056579099968,114.0,264.2265625,
23,0.5677974893661167,2026-05-16 10:26:31.061225,2026-05-16 10:26:59.704529,0 days 00:00:28.643304,circular,PauliFeatureMap,"[""X"", ""Z""]",3,0.5677974893661167,COMPLETE,23,PauliFeatureMap,3,circular,"[""X"", ""Z""]",completed,,0.5833333333333334,0.5841269841269842,0.565873015873016,0.5677974893661167,0.5813362381989833,17.09219911834225,11.545685296878219,116.0,264.25390625,
24,0.4753086419753086,2026-05-16 10:26:59.705378,2026-05-16 10:27:29.569431,0 days 00:00:29.864053,circular,PauliFeatureMap,"[""X"", ""Y"", ""Z""]",2,0.4753086419753086,COMPLETE,24,PauliFeatureMap,2,circular,"[""X"", ""Y"", ""Z""]",completed,,0.5555555555555556,0.5374269005847953,0.5174603174603175,0.4753086419753086,0.5030864197530864,17.727561437059194,12.132093119900674,119.0,264.2578125,
25,0.0,2026-05-16 10:27:29.570284,2026-05-16 10:27:29.573232,0 days 00:00:00.002948,circular,ZFeatureMap,,3,,COMPLETE,25,ZFeatureMap,3,circular,,failed,'NoneType' object has no attribute 'items',,,,,,,,,,
26,0.8580827067669173,2026-05-16 10:27:29.573850,2026-05-16 10:28:10.612980,0 days 00:00:41.039130,circular,PauliFeatureMap,"[""X"", ""Y"", ""Z""]",3,0.8580827067669173,COMPLETE,26,PauliFeatureMap,3,circular,"[""X"", ""Y"", ""Z""]",completed,,0.8611111111111112,0.8888888888888888,0.85,0.8580827067669173,0.8599101921470341,24.463854733854532,16.571209664922208,107.4,264.26953125,
27,0.8580827067669173,2026-05-16 10:28:10.614320,2026-05-16 10:28:50.496239,0 days 00:00:39.881919,circular,PauliFeatureMap,"[""X"", ""Y"", ""Z""]",3,0.8580827067669173,COMPLETE,27,PauliFeatureMap,3,circular,"[""X"", ""Y"", ""Z""]",completed,,0.8611111111111112,0.8888888888888888,0.85,0.8580827067669173,0.8599101921470341,23.679352683015168,16.19924281630665,10117.9,264.5234375,
28,0.4753086419753086,2026-05-16 10:28:50.497109,2026-05-16 10:29:19.354459,0 days 00:00:28.857350,circular,PauliFeatureMap,"[""X"", ""Y"", ""Z""]",2,0.4753086419753086,COMPLETE,28,PauliFeatureMap,2,circular,"[""X"", ""Y"", ""Z""]",completed,,0.5555555555555556,0.5374269005847953,0.5174603174603175,0.4753086419753086,0.5030864197530864,17.11260290397331,11.74044709885493,103.3,264.52734375,
29,0.0,2026-05-16 10:29:19.355302,2026-05-16 10:29:19.358290,0 days 00:00:00.002988,circular,ZFeatureMap,,3,,COMPLETE,29,ZFeatureMap,3,circular,,failed,'NoneType' object has no attribute 'items',,,,,,,,,,
30,0.30105105105105107,2026-05-16 10:29:19.358915,2026-05-16 10:29:38.356603,0 days 00:00:18.997688,linear,PauliFeatureMap,"[""ZZ""]",3,0.30105105105105107,COMPLETE,30,PauliFeatureMap,3,linear,"[""ZZ""]",completed,,0.3888888888888889,0.26932367149758457,0.3531746031746032,0.30105105105105107,0.3280780780780781,11.128544752951711,7.866127880755812,214.2,264.52734375,
31,0.8580827067669173,2026-05-16 10:29:38.357451,2026-05-16 10:30:18.832460,0 days 00:00:40.475009,circular,PauliFeatureMap,"[""X"", ""Y"", ""Z""]",3,0.8580827067669173,COMPLETE,31,PauliFeatureMap,3,circular,"[""X"", ""Y"", ""Z""]",completed,,0.8611111111111112,0.8888888888888888,0.85,0.8580827067669173,0.8599101921470341,23.910285043064505,16.560341996140778,165.7,264.6015625,
32,0.8580827067669173,2026-05-16 10:30:18.834566,2026-05-16 10:30:59.615026,0 days 00:00:40.780460,circular,PauliFeatureMap,"[""X"", ""Y"", ""Z""]",3,0.8580827067669173,COMPLETE,32,PauliFeatureMap,3,circular,"[""X"", ""Y"", ""Z""]",completed,,0.8611111111111112,0.8888888888888888,0.85,0.8580827067669173,0.8599101921470341,24.25127915572375,16.5234773051925,107.8,264.61328125,
33,0.8580827067669173,2026-05-16 10:30:59.615876,2026-05-16 10:31:40.657685,0 days 00:00:41.041809,circular,PauliFeatureMap,"[""X"", ""Y"", ""Z""]",3,0.8580827067669173,COMPLETE,33,PauliFeatureMap,3,circular,"[""X"", ""Y"", ""Z""]",completed,,0.8611111111111112,0.8888888888888888,0.85,0.8580827067669173,0.8599101921470341,24.334743748884648,16.70089310919866,123.7,264.65234375,
34,0.8374727668845315,2026-05-16 10:31:40.658516,2026-05-16 10:32:02.330472,0 days 00:00:21.671956,circular,PauliFeatureMap,"[""X"", ""Z""]",2,0.8374727668845315,COMPLETE,34,PauliFeatureMap,2,circular,"[""X"", ""Z""]",completed,,0.8333333333333334,0.9,0.8222222222222223,0.8374727668845315,0.8338416848220771,12.884938220027834,8.782583802938461,251.2,264.65234375,
35,0.8282828282828284,2026-05-16 10:32:02.331312,2026-05-16 10:32:15.872572,0 days 00:00:13.541260,linear,PauliFeatureMap,"[""Z""]",2,0.8282828282828284,COMPLETE,35,PauliFeatureMap,2,linear,"[""Z""]",completed,,0.8333333333333334,0.8375,0.8261904761904763,0.8282828282828284,0.831986531986532,7.97777449619025,5.558950420003384,101.9,264.65234375,
36,0.0,2026-05-16 10:32:15.873413,2026-05-16 10:32:15.876343,0 days 00:00:00.002930,circular,ZFeatureMap,,3,,COMPLETE,36,ZFeatureMap,3,circular,,failed,'NoneType' object has no attribute 'items',,,,,,,,,,
37,0.5461111111111111,2026-05-16 10:32:15.876997,2026-05-16 10:32:46.521326,0 days 00:00:30.644329,circular,PauliFeatureMap,"[""Z"", ""ZZ""]",3,0.5461111111111111,COMPLETE,37,PauliFeatureMap,3,circular,"[""Z"", ""ZZ""]",completed,,0.5555555555555556,0.6056980056980057,0.5380952380952381,0.5461111111111111,0.5512037037037038,18.113983309827745,12.527053116820753,105.0,264.65234375,
38,0.45488721804511273,2026-05-16 10:32:46.522168,2026-05-16 10:33:13.370153,0 days 00:00:26.847985,linear,ZZFeatureMap,,3,0.45488721804511273,COMPLETE,38,ZZFeatureMap,3,linear,,completed,,0.5,0.5277777777777778,0.4674603174603174,0.45488721804511273,0.47117794486215536,16.04031403409317,10.802412963937968,104.5,264.65234375,
39,0.8580827067669173,2026-05-16 10:33:13.371324,2026-05-16 10:33:54.273734,0 days 00:00:40.902410,circular,PauliFeatureMap,"[""X"", ""Y"", ""Z""]",3,0.8580827067669173,COMPLETE,39,PauliFeatureMap,3,circular,"[""X"", ""Y"", ""Z""]",completed,,0.8611111111111112,0.8888888888888888,0.85,0.8580827067669173,0.8599101921470341,24.25796303106472,16.638884777203202,226.0,264.75,
