number,value,datetime_start,datetime_complete,duration,params_entanglement,params_feature_map_type,params_paulis,params_reps,user_attrs_macro_f1,state,trial_number,feature_map_type,reps,entanglement,paulis,status,error_message,accuracy,macro_precision,macro_recall,macro_f1,weighted_f1,fit_time_seconds,inference_time_seconds,peak_cpu_percent,peak_ram_mb,peak_gpu_memory_mb
0,0.8646973941091588,2026-06-17 11:40:50.270622,2026-06-17 11:41:10.253237,0 days 00:00:19.982615,linear,ZZFeatureMap,,2,0.8646973941091588,COMPLETE,0,ZZFeatureMap,2,linear,,completed,,0.8666666666666667,0.8863636363636364,0.8666666666666667,0.8646973941091588,0.8646973941091588,11.88209199999983,8.093350400000418,101.7,249.19921875,4133.06640625
1,0.0,2026-06-17 11:41:10.253237,2026-06-17 11:41:10.254236,0 days 00:00:00.000999,linear,ZFeatureMap,,1,,COMPLETE,1,ZFeatureMap,1,linear,,failed,'NoneType' object has no attribute 'items',,,,,,,,,,
2,0.9333333333333332,2026-06-17 11:41:10.254236,2026-06-17 11:41:31.867126,0 days 00:00:21.612890,full,PauliFeatureMap,"[""Y"", ""Z""]",2,0.9333333333333332,COMPLETE,2,PauliFeatureMap,2,full,"[""Y"", ""Z""]",completed,,0.9333333333333333,0.9333333333333332,0.9333333333333332,0.9333333333333332,0.9333333333333333,12.965845400000035,8.642653199998676,104.2,248.51171875,4138.19140625
3,0.7999999999999999,2026-06-17 11:41:31.867126,2026-06-17 11:41:58.616994,0 days 00:00:26.749868,full,ZZFeatureMap,,2,0.7999999999999999,COMPLETE,3,ZZFeatureMap,2,full,,completed,,0.8,0.7999999999999999,0.7999999999999999,0.7999999999999999,0.8,15.912725400001364,10.831561500001044,118.7,249.43359375,4136.41015625
4,0.0,2026-06-17 11:41:58.616994,2026-06-17 11:41:58.616994,0 days 00:00:00,linear,ZFeatureMap,,1,,COMPLETE,4,ZFeatureMap,1,linear,,failed,'NoneType' object has no attribute 'items',,,,,,,,,,
5,0.8306878306878307,2026-06-17 11:41:58.617994,2026-06-17 11:42:11.918591,0 days 00:00:13.300597,linear,PauliFeatureMap,"[""Z"", ""ZZ""]",1,0.8306878306878307,COMPLETE,5,PauliFeatureMap,1,linear,"[""Z"", ""ZZ""]",completed,,0.8333333333333334,0.837121212121212,0.8333333333333334,0.8306878306878307,0.8306878306878306,7.969654000000446,5.327606099999684,151.2,249.78515625,4125.37890625
6,0.8664160401002506,2026-06-17 11:42:11.918591,2026-06-17 11:42:29.107605,0 days 00:00:17.189014,full,ZZFeatureMap,,1,0.8664160401002506,COMPLETE,6,ZZFeatureMap,1,full,,completed,,0.8666666666666667,0.869023569023569,0.8666666666666667,0.8664160401002506,0.8664160401002506,10.405843399999867,6.779324299999644,100.5,249.640625,4130.50390625
7,0.8664160401002506,2026-06-17 11:42:29.107605,2026-06-17 11:42:46.851147,0 days 00:00:17.743542,full,ZZFeatureMap,,1,0.8664160401002506,COMPLETE,7,ZZFeatureMap,1,full,,completed,,0.8666666666666667,0.869023569023569,0.8666666666666667,0.8664160401002506,0.8664160401002506,10.19846839999991,7.540214599999672,100.0,250.0234375,4124.72265625
8,0.9015037593984961,2026-06-17 11:42:46.851147,2026-06-17 11:43:03.216882,0 days 00:00:16.365735,circular,ZZFeatureMap,,1,0.9015037593984961,COMPLETE,8,ZZFeatureMap,1,circular,,completed,,0.9,0.9060606060606061,0.9,0.9015037593984961,0.9015037593984961,9.81945369999994,6.541839900000923,100.2,249.734375,4123.03515625
9,0.8330827067669172,2026-06-17 11:43:03.216882,2026-06-17 11:43:27.359295,0 days 00:00:24.142413,circular,ZZFeatureMap,,2,0.8330827067669172,COMPLETE,9,ZZFeatureMap,2,circular,,completed,,0.8333333333333334,0.8356902356902357,0.8333333333333334,0.8330827067669172,0.8330827067669172,14.338690600001428,9.798860599999898,151.2,251.28515625,4110.49609375
10,0.8341307814992026,2026-06-17 11:43:27.359295,2026-06-17 11:43:58.376327,0 days 00:00:31.017032,full,PauliFeatureMap,"[""Y"", ""Z""]",3,0.8341307814992026,COMPLETE,10,PauliFeatureMap,3,full,"[""Y"", ""Z""]",completed,,0.8333333333333334,0.8425925925925926,0.8333333333333334,0.8341307814992026,0.8341307814992026,18.26044980000006,12.750903899999685,101.8,251.01953125,4110.49609375
11,0.8341307814992026,2026-06-17 11:43:58.376327,2026-06-17 11:44:38.792800,0 days 00:00:40.416473,circular,PauliFeatureMap,"[""Y"", ""Z""]",3,0.8341307814992026,COMPLETE,11,PauliFeatureMap,3,circular,"[""Y"", ""Z""]",completed,,0.8333333333333334,0.8425925925925926,0.8333333333333334,0.8341307814992026,0.8341307814992026,21.84683160000168,18.56290910000098,104.5,252.25390625,5935.67578125
12,0.8666666666666667,2026-06-17 11:44:38.792800,2026-06-17 11:45:08.431191,0 days 00:00:29.638391,circular,PauliFeatureMap,"[""X"", ""Z""]",2,0.8666666666666667,COMPLETE,12,PauliFeatureMap,2,circular,"[""X"", ""Z""]",completed,,0.8666666666666667,0.8666666666666667,0.8666666666666667,0.8666666666666667,0.8666666666666667,18.16568030000053,11.466864900001383,293.0,252.0546875,6097.73046875
13,0.7029239766081871,2026-06-17 11:45:08.431191,2026-06-17 11:45:32.807848,0 days 00:00:24.376657,circular,PauliFeatureMap,"[""ZZ""]",2,0.7029239766081871,COMPLETE,13,PauliFeatureMap,2,circular,"[""ZZ""]",completed,,0.7,0.7084175084175084,0.7000000000000001,0.7029239766081871,0.7029239766081871,14.656037900000229,9.712961900000664,151.2,252.5625,6277.98046875
14,0.0,2026-06-17 11:45:32.807848,2026-06-17 11:45:32.809859,0 days 00:00:00.002011,full,ZFeatureMap,,3,,COMPLETE,14,ZFeatureMap,3,full,,failed,'NoneType' object has no attribute 'items',,,,,,,,,,
15,0.8330827067669172,2026-06-17 11:45:32.810373,2026-06-17 11:46:01.194718,0 days 00:00:28.384345,circular,ZZFeatureMap,,2,0.8330827067669172,COMPLETE,15,ZZFeatureMap,2,circular,,completed,,0.8333333333333334,0.8356902356902357,0.8333333333333334,0.8330827067669172,0.8330827067669172,17.179619300000923,11.197809199999028,100.0,252.48828125,6443.34765625
16,0.8026483320600968,2026-06-17 11:46:01.194718,2026-06-17 11:46:23.729280,0 days 00:00:22.534562,full,PauliFeatureMap,"[""X"", ""Y"", ""Z""]",1,0.8026483320600968,COMPLETE,16,PauliFeatureMap,1,full,"[""X"", ""Y"", ""Z""]",completed,,0.8,0.8282828282828283,0.7999999999999999,0.8026483320600968,0.8026483320600967,12.591606599999068,9.935927400001674,108.0,252.74609375,6390.59765625
17,0.9015037593984961,2026-06-17 11:46:23.729280,2026-06-17 11:46:43.847830,0 days 00:00:20.118550,circular,PauliFeatureMap,"[""Z""]",3,0.9015037593984961,COMPLETE,17,PauliFeatureMap,3,circular,"[""Z""]",completed,,0.9,0.9060606060606061,0.9,0.9015037593984961,0.9015037593984961,12.695132299999386,7.41695400000026,104.2,252.03515625,6186.96484375
18,0.7999999999999999,2026-06-17 11:46:43.847830,2026-06-17 11:47:21.188579,0 days 00:00:37.340749,full,ZZFeatureMap,,2,0.7999999999999999,COMPLETE,18,ZZFeatureMap,2,full,,completed,,0.8,0.7999999999999999,0.7999999999999999,0.7999999999999999,0.8,22.557892300003004,14.776877899999818,100.1,252.85546875,6219.15234375
19,0.0,2026-06-17 11:47:21.188579,2026-06-17 11:47:21.190093,0 days 00:00:00.001514,circular,ZFeatureMap,,1,,COMPLETE,19,ZFeatureMap,1,circular,,failed,'NoneType' object has no attribute 'items',,,,,,,,,,
20,0.9333333333333332,2026-06-17 11:47:21.190093,2026-06-17 11:47:47.483975,0 days 00:00:26.293882,full,PauliFeatureMap,"[""Y"", ""Z""]",2,0.9333333333333332,COMPLETE,20,PauliFeatureMap,2,full,"[""Y"", ""Z""]",completed,,0.9333333333333333,0.9333333333333332,0.9333333333333332,0.9333333333333332,0.9333333333333333,16.418065699999715,9.868893899998511,126.0,253.66015625,6167.65234375
21,0.9333333333333332,2026-06-17 11:47:47.484496,2026-06-17 11:48:15.185599,0 days 00:00:27.701103,full,PauliFeatureMap,"[""Y"", ""Z""]",2,0.9333333333333332,COMPLETE,21,PauliFeatureMap,2,full,"[""Y"", ""Z""]",completed,,0.9333333333333333,0.9333333333333332,0.9333333333333332,0.9333333333333332,0.9333333333333333,16.529488299998775,11.16410790000009,100.3,253.54296875,6206.27734375
22,0.9333333333333332,2026-06-17 11:48:15.186123,2026-06-17 11:48:42.715115,0 days 00:00:27.528992,full,PauliFeatureMap,"[""Y"", ""Z""]",2,0.9333333333333332,COMPLETE,22,PauliFeatureMap,2,full,"[""Y"", ""Z""]",completed,,0.9333333333333333,0.9333333333333332,0.9333333333333332,0.9333333333333332,0.9333333333333333,17.1782028000016,10.345374299999094,201.6,252.26953125,6438.11328125
23,0.9333333333333332,2026-06-17 11:48:42.716620,2026-06-17 11:49:07.894439,0 days 00:00:25.177819,full,PauliFeatureMap,"[""Y"", ""Z""]",2,0.9333333333333332,COMPLETE,23,PauliFeatureMap,2,full,"[""Y"", ""Z""]",completed,,0.9333333333333333,0.9333333333333332,0.9333333333333332,0.9333333333333332,0.9333333333333333,15.24700010000015,9.924139099999593,117.0,252.71484375,6682.484375
24,0.9333333333333332,2026-06-17 11:49:07.894439,2026-06-17 11:49:32.677720,0 days 00:00:24.783281,full,PauliFeatureMap,"[""Y"", ""Z""]",2,0.9333333333333332,COMPLETE,24,PauliFeatureMap,2,full,"[""Y"", ""Z""]",completed,,0.9333333333333333,0.9333333333333332,0.9333333333333332,0.9333333333333332,0.9333333333333333,15.197864099998696,9.579738799999177,102.5,252.46875,6371.75
25,0.9333333333333332,2026-06-17 11:49:32.678226,2026-06-17 11:49:57.401254,0 days 00:00:24.723028,full,PauliFeatureMap,"[""Y"", ""Z""]",2,0.9333333333333332,COMPLETE,25,PauliFeatureMap,2,full,"[""Y"", ""Z""]",completed,,0.9333333333333333,0.9333333333333332,0.9333333333333332,0.9333333333333332,0.9333333333333333,14.615104099997552,10.10265530000106,104.2,253.25390625,7129.5703125
26,0.8341307814992026,2026-06-17 11:49:57.401254,2026-06-17 11:50:31.082708,0 days 00:00:33.681454,full,PauliFeatureMap,"[""Y"", ""Z""]",3,0.8341307814992026,COMPLETE,26,PauliFeatureMap,3,full,"[""Y"", ""Z""]",completed,,0.8333333333333334,0.8425925925925926,0.8333333333333334,0.8341307814992026,0.8341307814992026,19.546026100000745,14.130308700001478,110.2,254.1015625,6994.18359375
27,0.8026483320600967,2026-06-17 11:50:31.083712,2026-06-17 11:50:56.320539,0 days 00:00:25.236827,full,PauliFeatureMap,"[""ZZ""]",2,0.8026483320600967,COMPLETE,27,PauliFeatureMap,2,full,"[""ZZ""]",completed,,0.8,0.8282828282828283,0.8000000000000002,0.8026483320600967,0.8026483320600967,14.415213500000391,10.816271400002734,108.0,253.39453125,7239.68359375
28,0.8666666666666667,2026-06-17 11:50:56.320539,2026-06-17 11:51:20.915449,0 days 00:00:24.594910,full,PauliFeatureMap,"[""X"", ""Z""]",2,0.8666666666666667,COMPLETE,28,PauliFeatureMap,2,full,"[""X"", ""Z""]",completed,,0.8666666666666667,0.8666666666666667,0.8666666666666667,0.8666666666666667,0.8666666666666667,14.484757900001568,10.102528000003076,101.9,253.765625,6806.5703125
29,0.6726841257733707,2026-06-17 11:51:20.915449,2026-06-17 11:51:52.837634,0 days 00:00:31.922185,linear,PauliFeatureMap,"[""Z"", ""ZZ""]",3,0.6726841257733707,COMPLETE,29,PauliFeatureMap,3,linear,"[""Z"", ""ZZ""]",completed,,0.6666666666666666,0.6933760683760685,0.6666666666666666,0.6726841257733707,0.6726841257733707,18.85761629999979,13.059439799999382,133.0,254.30078125,6302.9765625
30,0.9333333333333332,2026-06-17 11:51:52.837634,2026-06-17 11:52:07.434881,0 days 00:00:14.597247,full,PauliFeatureMap,"[""Z""]",2,0.9333333333333332,COMPLETE,30,PauliFeatureMap,2,full,"[""Z""]",completed,,0.9333333333333333,0.9333333333333332,0.9333333333333332,0.9333333333333332,0.9333333333333333,8.606436300000496,5.985047599999234,105.6,253.98828125,6302.9765625
31,0.9333333333333332,2026-06-17 11:52:07.434881,2026-06-17 11:52:32.753364,0 days 00:00:25.318483,full,PauliFeatureMap,"[""Y"", ""Z""]",2,0.9333333333333332,COMPLETE,31,PauliFeatureMap,2,full,"[""Y"", ""Z""]",completed,,0.9333333333333333,0.9333333333333332,0.9333333333333332,0.9333333333333332,0.9333333333333333,15.277149500001542,10.035433099998045,103.7,253.90234375,6302.9765625
32,0.9333333333333332,2026-06-17 11:52:32.753364,2026-06-17 11:52:58.256503,0 days 00:00:25.503139,full,PauliFeatureMap,"[""Y"", ""Z""]",2,0.9333333333333332,COMPLETE,32,PauliFeatureMap,2,full,"[""Y"", ""Z""]",completed,,0.9333333333333333,0.9333333333333332,0.9333333333333332,0.9333333333333332,0.9333333333333333,14.650435700001253,10.846648599999753,107.8,253.98046875,6302.9765625
33,0.9333333333333332,2026-06-17 11:52:58.256503,2026-06-17 11:53:22.657263,0 days 00:00:24.400760,full,PauliFeatureMap,"[""Y"", ""Z""]",2,0.9333333333333332,COMPLETE,33,PauliFeatureMap,2,full,"[""Y"", ""Z""]",completed,,0.9333333333333333,0.9333333333333332,0.9333333333333332,0.9333333333333332,0.9333333333333333,14.599467600000935,9.796035200000915,108.6,254.296875,6302.9765625
34,0.0,2026-06-17 11:53:22.657263,2026-06-17 11:53:22.659323,0 days 00:00:00.002060,linear,ZFeatureMap,,2,,COMPLETE,34,ZFeatureMap,2,linear,,failed,'NoneType' object has no attribute 'items',,,,,,,,,,
35,0.771345029239766,2026-06-17 11:53:22.660323,2026-06-17 11:53:56.074414,0 days 00:00:33.414091,full,PauliFeatureMap,"[""X"", ""Y"", ""Z""]",2,0.771345029239766,COMPLETE,35,PauliFeatureMap,2,full,"[""X"", ""Y"", ""Z""]",completed,,0.7666666666666667,0.7787878787878787,0.7666666666666666,0.771345029239766,0.771345029239766,20.238518199999817,13.169754699996702,101.7,254.3671875,6302.9765625
36,0.0,2026-06-17 11:53:56.075414,2026-06-17 11:53:56.076420,0 days 00:00:00.001006,full,ZFeatureMap,,2,,COMPLETE,36,ZFeatureMap,2,full,,failed,'NoneType' object has no attribute 'items',,,,,,,,,,
37,0.9333333333333332,2026-06-17 11:53:56.076420,2026-06-17 11:54:19.377465,0 days 00:00:23.301045,linear,PauliFeatureMap,"[""Y"", ""Z""]",2,0.9333333333333332,COMPLETE,37,PauliFeatureMap,2,linear,"[""Y"", ""Z""]",completed,,0.9333333333333333,0.9333333333333332,0.9333333333333332,0.9333333333333332,0.9333333333333333,13.836688200000935,9.457326200001262,100.1,254.7578125,6302.9765625
38,0.8026483320600968,2026-06-17 11:54:19.377465,2026-06-17 11:54:34.597659,0 days 00:00:15.220194,full,PauliFeatureMap,"[""Y"", ""Z""]",1,0.8026483320600968,COMPLETE,38,PauliFeatureMap,1,full,"[""Y"", ""Z""]",completed,,0.8,0.8282828282828283,0.7999999999999999,0.8026483320600968,0.8026483320600967,9.103672900000674,6.109053700001823,100.1,254.77734375,6302.9765625
39,0.9333333333333332,2026-06-17 11:54:34.597659,2026-06-17 11:55:00.747185,0 days 00:00:26.149526,full,PauliFeatureMap,"[""Y"", ""Z""]",2,0.9333333333333332,COMPLETE,39,PauliFeatureMap,2,full,"[""Y"", ""Z""]",completed,,0.9333333333333333,0.9333333333333332,0.9333333333333332,0.9333333333333332,0.9333333333333333,16.04583470000216,10.098420400001487,133.0,254.8984375,6319.453125
